id,title,score_badge,score_text,score_subtext,thumbnail,site,full_address,full_description,room
607,樓上民宿,9,好極了,35 則評語,https://cf.bstatic.com/xdata/images/hotel/square600/250249407.jpg?k=c2efb3902585d0714ddc41780cc9a34f6b4d8e45bfe8f0dc1431d4a90b16b6bf,https://www.booking.com/hotel/tw/theupstairslou-shang-min-su.zh-tw.html,花蓮縣花蓮市Hualien City延平街6號2樓,"The Upstairs Homestay 位於花蓮市，提供附空調和 WiFi（免費）的住宿，距離 Beibin Park Beach 1.7 公里。
The Upstairs Homestay 設有附沖洗座的私人衛浴，並提供平面電視、拖鞋和吹風機。
住客還可以在共用休息室放鬆身心。
這間住宿附近的人氣景點包括花蓮天惠堂、美崙山生態公園和東線鐵道遺址。最近的機場是花蓮機場，距離 The Upstairs Homestay 5 公里。",園景雙人房、園景四人房、標準雙人房
608,聖托里尼民宿,8.6,很棒,217 則評語,https://cf.bstatic.com/xdata/images/hotel/square600/58271921.jpg?k=43597edde17bcc1ae6abca00155ca9c49a23a7973b5c81a70a5988f8ea534f32,https://www.booking.com/hotel/tw/sheng-tuo-li-ni-min-su.zh-tw.html,花蓮縣鹽寮村福德107-1號,"聖托里尼民宿飽覽壯麗海景，距離遠雄海洋公園僅 1 分鐘車程，藍白色建築充滿希臘風情與地中海風格，全館提供免費無線上網。
聖托里尼民宿距離松園別館 22 分鐘車程，距離七星潭 37 分鐘車程，距離花​​蓮火車站 30 分鐘車程，距離最近的花蓮機場 35 分鐘車程。為提供旅途便利性，民宿可應要求提供接駁服務。
每間客房均設有空調、平面電視、冰箱和電熱水壺，部分客房設有陽台，可欣賞海景，私人衛浴配有淋浴設施、免費盥洗用品和吹風機，部分客房浴室配備浴缸。
民宿工作人員竭誠為住客提供免費行李寄存服務，另提供票務服務。
民宿每日供應早餐。",海景雙人房、側面海景豪華雙人房、標準四人房、標準家庭房
609,奇遇85民宿,9,好極了,19 則評語,https://cf.bstatic.com/xdata/images/hotel/square600/100847097.jpg?k=3ea9424566dae6076a938ac44cc25b75cbf806a81f27c7289b0d4166c516cae3,https://www.booking.com/hotel/tw/qi-yu-85.zh-tw.html,"花蓮縣吉安No. 85, Jianchang Road","預訂奇遇85民宿可享 Genius 折扣！只要登入，預訂此住宿即可省一筆。
奇遇85民宿位在吉安，設有共用休息室和 WiFi（免費），距離 Beibin Park Beach 2.7 公里，距離花蓮慈惠堂 1.5 公里。
所有房型均有私人衛浴、空調、平面電視和冰箱。
奇遇85民宿距離吉安慶修院 5 公里，距離知卡宣森林公園 5 公里。最近的機場是花蓮機場，距離這間住宿 5 公里。",雙人房－附私人衛浴、雙人房－附私人衛浴、標準四人房、標準四人房、標準四人房
610,東畔民宿,8,非常好,79 則評語,https://cf.bstatic.com/xdata/images/hotel/square600/172948721.jpg?k=dd7b5e5eb625591b4db1b7bb48236638d776c2474ca263e3535a989a3f2e1b05,https://www.booking.com/hotel/tw/dong-pan-min-su.zh-tw.html,花蓮縣平和村大學路二段63巷39號,"預訂東畔民宿可享 Genius 折扣！只要登入，預訂此住宿即可省一筆。
Dong Pan B&B 位在花蓮縣的平和村，附設免費私人停車位。
所有房型都有戶外休息區、空調、平面電視，以及私人衛浴，並提供淋浴設施和拖鞋。住宿提供冰箱和電熱水壺。
Dong Pan B&B 提供露台和花園。
這間住宿距離花蓮市 12 公里。最近的機場是花蓮機場，距離 Dong Pan B&B 16 公里。",四人房－附陽台、經典四人房
611,海的聲音,9.4,好極了,426 則評語,https://cf.bstatic.com/xdata/images/hotel/square600/99511612.jpg?k=36c4a0b7f8bf1d9757780413151879bd41265d6b758d2cd8527f0b50db760965,https://www.booking.com/hotel/tw/xing-ye-hai-bian-du-jia-min-su.zh-tw.html,花蓮縣鹽寮村福德16-1號,"海的聲音位於壽豐，距離遠雄海洋公園僅有1分鐘的車程，其所有客房均享有海景。民宿提供覆蓋各處的免費WiFi和免費內部私人停車場。
海的聲音距離花蓮市中心有15分鐘車程，距離磯崎海灘和花蓮火車站有30分鐘車程，距離石梯坪有50分鐘車程，距離花蓮機場有1小時車程，距離石梯坪有50分鐘車程。
客房配有空調、平板電視和電熱水壺。部分客房設有客廳，為客人提供方便。額外設施包括拖鞋和免費洗浴用品。
民宿的旅遊諮詢台提供額外收費的機場班車服務。民宿還設有私人花園和陽光露台。",海景雙人房、海景特大雙人床房、海景雙床房
612,博客來民宿,8.4,非常好,33 則評語,https://cf.bstatic.com/xdata/images/hotel/square600/176686858.jpg?k=b9b218f7511a073cf74ea57d6e0cdc24dea02350e72f1e92abd00a95a30f8454,https://www.booking.com/hotel/tw/bo-ke-lai-min-su.zh-tw.html,花蓮縣花蓮市Hualien City博愛街65號,"預訂博客來民宿可享 Genius 折扣！只要登入，預訂此住宿即可省一筆。
Bookline B&B 位在花蓮市，提供 WiFi（免費）、電視、共用休息室和露台。
Bookline B&B 提供租車服務。
這間住宿附近的人氣景點包括 Beibin Park Beach、花蓮鐵道文化園區和東線鐵道遺址。最近的機場是花蓮機場，距離 Bookline B&B 6 公里。",大型雙人房、大型雙人房、大型雙人房、大型雙人房、家庭房－附衛浴、家庭房－附衛浴、家庭房－附衛浴、家庭房－附衛浴、家庭房－附衛浴、家庭房－附衛浴
613,蕾蜜兒花園民宿,8.1,非常好,56 則評語,https://cf.bstatic.com/xdata/images/hotel/square600/259841895.jpg?k=2d9e04cf919f0f5c5fc87961a1f63b826277559d457b44f4f291d12568189842,https://www.booking.com/hotel/tw/lei-mi-er-hua-yuan-min-su.zh-tw.html,花蓮縣平和村豐坪路三段1135巷26號,"Lei Mi Er Hua Yuan Min Su 位於平和村，設有餐廳，提供 WiFi（免費），距離花蓮市 18 公里。館內提供私人停車位。
Lei Mi Er Hua Yuan Min Su 設有附沖洗座的私人衛浴，並提供平面電視、拖鞋和吹風機。
這間住宿的住客可以享用自助式早餐。
Lei Mi Er Hua Yuan Min Su 有陽光露台。
Lei Mi Er Hua Yuan Min Su 的住客可在附近騎自行車，或使用花園。
最近的機場是花蓮機場，距離這間住宿 22 公里。",豪華雙人房－附 2 張雙人床、山景四人房、山景三人房
614,街角民宿--近火車站,8.9,很棒,90 則評語,https://cf.bstatic.com/xdata/images/hotel/square600/250156732.jpg?k=82c32fddd164e2ede7e344343184ff28d24aeed335afbe59b04f47027da45424,https://www.booking.com/hotel/tw/corner-homestay.zh-tw.html,"花蓮縣花蓮市Hualien CityNo. 560, Zhongshan Road","預訂街角民宿--近火車站可享 Genius 折扣！只要登入，預訂此住宿即可省一筆。
街角民宿提供時尚的住宿，地理位置便利，距離花蓮火車後站不到 4 分鐘步行路程。客房提供免費有線網路，館內並設有收費停車場。
空調客房鋪有鑲木地板，並配備平面有線電視、電熱水壺、冰箱和休憩區。房內設有私人衛浴，提供淋浴設施、吹風機和免費盥洗用品。
客人可以在街角民宿租用自行車探索鄰近景點。民宿提供行李寄存服務，並於公共區域提供免費 WiFi。所有客房均可乘電梯抵達。
民宿距離花蓮機場、自強夜市和七星潭風景區有不到 15 分鐘車程，距離太魯閣國家公園則有 30 分鐘車程。",高級雙人房、商務雙床房、典雅雙人房、日式四人房、優雅四人房
615,瑞穗棕櫚湖渡假民宿,8.1,非常好,155 則評語,https://cf.bstatic.com/xdata/images/hotel/square600/86280795.jpg?k=6a50a957b2fcb71b54ecb8dfbfd76b094a5727ea9f1d3096d97bab6dab39b0b9,https://www.booking.com/hotel/tw/ruisui-palm-lakes-b-amp-b.zh-tw.html,花蓮縣瑞穗鄉五福路8號,"預訂瑞穗棕櫚湖渡假民宿可享 Genius 折扣！只要登入，預訂此住宿即可省一筆。
Ruisui Palm Lakes B&B 位於瑞穗鄉，享有湖景，設有餐廳、共用休息室、花園和露台。 Ruisui Palm Lakes B&B 提供 WiFi 和免費私人停車位。
所有房型均鋪有鑲木地板，設有設備齊全且附冰箱的簡易廚房、用餐區，以及附熱水按摩池和拖鞋的私人衛浴，也提供有線頻道平面電視。為了讓您更加方便，住宿可提供額外收費的毛巾和寢具。
這間住宿每天供應亞洲風味早餐。
Ruisui Palm Lakes B&B 有溫泉浴池。
住宿館內提供兒童遊樂區。住客可以在 Ruisui Palm Lakes B&B 附近騎自行車。
這間住宿距離瑞穗農場 5 公里。最近的機場是花蓮機場，距離 Ruisui Palm Lakes B&B 64 公里。",山景特大雙人床房、山景四人房、園景雙人房
616,加家民宿,8.5,非常好,201 則評語,https://cf.bstatic.com/xdata/images/hotel/square600/16722030.jpg?k=567e36a7aa7a3142937f1e6e8c7c7fd9e6bf70004eeb1ead3fc69c61627683c2,https://www.booking.com/hotel/tw/ja-ja-homestay.zh-tw.html,花蓮縣玉里鎮大禹里6鄰4-1號,"加家民宿位置便利，距離玉里火車站僅 8 分鐘車程。民宿環境優美，提供溫馨的住宿環境。民宿提供免費盥洗用品、瓶裝水和免費 WiFi。
客房裝飾簡單，配有優質寢具、電視、空調、木地板、衣櫃和吹風機。民宿每日供應簡便早餐。
觀光旅遊櫃檯可協助客人規劃旅遊行程。
民宿距離南安瀑布 30 分鐘車程，距離花蓮機場 1 小時又 40 分鐘車程，距離赤科山 35 分鐘車程。
距離不到 8 分鐘車程即有許多在地餐館。",標準雙人或雙床房、標準四人房、單人房－附淋浴
617,日光森林包棟親子民宿,9.1,好極了,43 則評語,https://cf.bstatic.com/xdata/images/hotel/square600/124860124.jpg?k=2396080c38e301c6ef13d175e74030be9a60b4b3c233f79af94c70ccf27aaa67,https://www.booking.com/hotel/tw/hua-lian-min-su-ri-guang-sen-lin-tian-yuan-xiang-cun-duo-ren-tao-fang-ke-jia-chu.zh-tw.html,"花蓮縣花蓮市Hualien CityNo. 17-1, Lane. 138, Section. 1, Zhongshan Road.","預訂日光森林包棟親子民宿可享 Genius 折扣！只要登入，預訂此住宿即可省一筆。
日光森林包棟親子民宿位在花蓮市，提供戶外休息區或陽台、WiFi（免費）、平面電視、共用休息室和花園。
日光森林包棟親子民宿有兒童遊樂區。
這間住宿提供租車服務。
日光森林包棟親子民宿距離松園別館 4.4 公里，距離花蓮縣立體育場不到 1 公里。最近的機場是花蓮機場，距離日光森林包棟親子民宿 4 公里。",標準雙人房、豪華雙人房、高級雙人房、豪華家庭房
618,花蓮瑞穗境籟迴嵐B&B民宿,9.6,傑出,150 則評語,https://cf.bstatic.com/xdata/images/hotel/square600/199213601.jpg?k=d63f661f33f941cf690d647eb531cfc231ab90460c59bfc3099ea94af2452cbd,https://www.booking.com/hotel/tw/hua-lian-rui-sui-jing-lai-hui-lan-b-amp-bmin-su.zh-tw.html,花蓮縣瑞穗鄉中正北路三段226號,"Jing Lai Hui Lan Homestay 位於瑞穗鄉，享有園景，設有餐廳和花園。住宿全館提供 WiFi（免費），館內提供私人停車位。
所有房型都有戶外休息區、空調、平面電視，以及私人衛浴，並提供淋浴設施和拖鞋。住宿提供冰箱和電熱水壺。
Jing Lai Hui Lan Homestay 的住客可以享用歐陸式或美式早餐。
這間住宿距離瑞穗農場 13 公里。最近的機場是花蓮機場，距離 Jing Lai Hui Lan Homestay 56 公里。",山景雙人房、山景四人房、園景家庭房、園景家庭房、山景四人房
619,鮭魚歸魚,9.6,傑出,114 則評語,https://cf.bstatic.com/xdata/images/hotel/square600/215478473.jpg?k=7521928a166a123364abd75703b7c0d94dbd6abde2c027f7803cf1e5e6427992,https://www.booking.com/hotel/tw/gui-yu-gui-yu.zh-tw.html,花蓮縣花蓮市Hualien City建國路二段 790號,"預訂鮭魚歸魚可享 Genius 折扣！只要登入，預訂此住宿即可省一筆。
鮭魚歸魚位於花蓮市，距離松園別館 6 公里，距離花蓮縣立體育館 3.3 公里，享有山景，提供公共休息區和免費 WiFi。
住宿空間均設有陽台、空調與平面有線電視，並提供私人衛浴，附淋浴設施、吹風機和免費盥洗用品。
附近的咖啡館供應早餐。
鮭魚歸魚設有露台。
鮭魚歸魚距離慈濟文化園區 4 公里，距離花蓮天惠堂 5 公里。最近的機場是花蓮機場，距離住宿 6 公里。",豪華雙人房－附陽台、豪華四人房、家庭套房－附陽台
620,花田雅筑,9.6,傑出,32 則評語,https://cf.bstatic.com/xdata/images/hotel/square600/78564454.jpg?k=c70f0969a808dc6adcc6f703b310b88c1af15e6c13363995d6cb3e84fba830b3,https://www.booking.com/hotel/tw/hua-tian-ya-zhu.zh-tw.html,花蓮縣吉安南華一街280號,"Flower 280 位在吉安，提供 WiFi（免費）、空調、免費自行車租借服務和共用休息室，距離蓮城蓮花園 1.3 公里，距離吉安慶修院 2.5 公里。館內提供私人停車位。
Flower 280 每天供應歐陸式早餐。
這間住宿有兒童遊樂區。
這間住宿提供附烤肉設備的花園。住客可以在附近健行。
Flower 280 距離知卡宣森林公園 5 公里，距離花蓮慈惠堂 5 公里。最近的機場是花蓮機場，距離 Flower 280 10 公里。",豪華雙人房（2 位成人 + 1 名兒童）、豪華四人房、山景四人房
621,近月旭海民宿,8.5,非常好,168 則評語,https://cf.bstatic.com/xdata/images/hotel/square600/164934400.jpg?k=b2d34a1317c928b6e847e9f094be2827b2ee399d3d531d233849338574f06f2c,https://www.booking.com/hotel/tw/sea-hi-homestay-hualien.zh-tw.html,花蓮縣鹽寮村鹽寮152號,"近月旭海位於花蓮，眺望著太平洋，面朝綠意盎然的寬敞庭院。民宿提供每日早餐和免費 WiFi。
客房享有海景，設有空調、平面有線電視、電熱水壺和冰箱。私人衛浴內配有盥洗用品。
民宿可為客人安排各種活動，例如露營和燒烤等。民宿也提供票券服務。
除了在餐廳用餐外，客人也可前往附近的餐飲場所品嚐各種中式、日式和西式美食。
民宿距離遠雄海洋公園 6 分鐘車程，距離南濱夜市 20 分鐘車程，距離松園別館、花蓮火車站和花蓮市均不到 30 分鐘車程，距離七星潭海灘約 40 分鐘車程。",雙人房、舒適三人房、標準四人房、海景四人房、海景 Villa
622,轉角愛後站旅宿(電梯),7.8,好,69 則評語,https://cf.bstatic.com/xdata/images/hotel/square600/268539412.jpg?k=f5d672faafc87d5b17ab84433b0c8055fa5a25a392c159dc7c1eba7c741fdc58,https://www.booking.com/hotel/tw/hou-zhan-ping-jia-min-su-hua-lian-shi123456789.zh-tw.html,花蓮縣花蓮市Hualien City富安路79號2樓,"後站平價民宿位於花蓮市，距離松園 2.1 公里。距離花蓮火車站（後站）僅有 3 分鐘步行路程。
民宿每間客房均配有空調和平面電視。客房配有私人衛浴。房內提供拖鞋、免費盥洗用品和吹風機。
館內設有觀光旅遊櫃檯。
民宿亦提供汽車租賃服務。距離慈濟文化園區 800 公尺，距離花蓮縣體育場 1.6 公里。",標準雙人房、標準四人房、經濟雙人房－無窗、豪華雙人或雙床房、三人房
623,艾莉恩民宿,9.7,傑出,46 則評語,https://cf.bstatic.com/xdata/images/hotel/square600/121134562.jpg?k=413b8708087c4333e01729ae5f0569625e39ff2f5fc037f0637a3349d8dee813,https://www.booking.com/hotel/tw/alien.zh-tw.html,花蓮縣花蓮市Hualien City中山路385號,"預訂艾莉恩民宿可享 Genius 折扣！只要登入，預訂此住宿即可省一筆。
艾莉恩民宿位於花蓮，距離花蓮火車站車程 5 分鐘，全館提供免費 WiFi。
所有客房均設有電視和空調。私人衛浴配有淋浴設施、吹風機和免費盥洗用品。您可以從客房欣賞城市景觀。
民宿提供免費機場接駁服務。並設有觀光旅遊櫃台，協助客人規劃旅程。",豪華雙人房、四人房－附私人衛浴、舒適三人房－附淋浴
624,川流不息民宿,8.4,非常好,20 則評語,https://cf.bstatic.com/xdata/images/hotel/square600/202727177.jpg?k=eea570133a5f79fa98133dbbf9db5b4d364aff6d9fb7185a1da6a8ab8e6b0be5,https://www.booking.com/hotel/tw/chuan-liu-bu-xi-min-su-hualien-county.zh-tw.html,花蓮縣花蓮市Hualien City長安街2-3號,"Chang-an House B&B 位在花蓮市，提供 WiFi（免費）、空調、免費自行車租借服務和共用休息室，距離 Beibin Park Beach 1.9 公里，距離松園別館 3.3 公里。
Chang-an House B&B 設有附淋浴設施的私人衛浴，並提供平面電視、吹風機和免費盥洗用品。
這間住宿提供租車服務。
Chang-an House B&B 附近的人氣景點包括花蓮文化創意產業園區、花蓮城隍廟和東線鐵道遺址。最近的機場是花蓮機場，距離 Chang-an House B&B 7 公里。",標準雙人房、家庭房、標準四人房、標準三人房
625,雨晴民宿,8.9,很棒,20 則評語,https://cf.bstatic.com/xdata/images/hotel/square600/114751299.jpg?k=1796548e949191cd4199ecc1afe4ca93ee28084a968f660bf01195a1e393fb5b,https://www.booking.com/hotel/tw/yu-qing-min-su-jian.zh-tw.html,花蓮縣吉安中興路186巷5號,"預訂雨晴民宿可享 Genius 折扣！只要登入，預訂此住宿即可省一筆。
Rain Sun Homestay 距離吉安慶修院 500 公尺，有餐廳和共用休息室，為了旅客的方便還提供共用廚房。住宿全館提供 WiFi（免費），館內提供私人停車位。
Rain Sun Homestay 有露台。
這間住宿提供租車服務。住客可以在附近騎自行車。
Rain Sun Homestay 距離花蓮慈惠堂 2.4 公里，距離蓮城蓮花園 3.9 公里。最近的機場是花蓮機場，距離 Rain Sun Homestay 8 公里。住宿提供付費機場接駁服務。",雙人房－附陽台、四人房、套房
626,水上民宿,8.8,很棒,56 則評語,https://cf.bstatic.com/xdata/images/hotel/square600/100473380.jpg?k=cb5b05510aaa8b7bd37e667d7f8c9bfd5d092c8ae836dadbbadb2e4d5ca58240,https://www.booking.com/hotel/tw/shui-shang-min-su-hua-lian-shi.zh-tw.html,花蓮縣花蓮市Hualien City中山路525巷2弄12號,"Over Water B&B 位在花蓮縣的花蓮市，靠近 Beibin Park Beach 和花蓮天惠堂，提供 WiFi（免費）和免費私人停車位。
每個房型都設有私人衛浴和淋浴設施、空調、平面電視以及冰箱。
Over Water B&B 每天供應亞洲風味早餐。
這間住宿附近的人氣景點包括美崙山生態公園、東線鐵道遺址和花蓮文化創意產業園區。最近的機場是花蓮機場，距離 Over Water B&B 4 公里。",標準雙人房、經典四人房、標準雙人房
627,花蓮蜂巢旅居,8,非常好,37 則評語,https://cf.bstatic.com/xdata/images/hotel/square600/100840768.jpg?k=55fb5196defc4bcbc750cad51d2536e838efe806dd48ff0e6b04bc96df636f97,https://www.booking.com/hotel/tw/feng-chao-lu-ju.zh-tw.html,花蓮縣花蓮市Hualien City建林街122號,"預訂花蓮蜂巢旅居可享 Genius 折扣！只要登入，預訂此住宿即可省一筆。
花蓮蜂巢旅居位於花蓮市，風格溫馨簡約，全館提供免費 WiFi。
飯店距離花蓮遠東百貨 2 分鐘車程，距離花蓮火車站 10 分鐘車程，距離七星潭海灘有 20 分鐘車程。
所有客房都配有空調和平面有線電視。私人衛浴配有淋浴設施、免費盥洗用品和吹風機。
公共區域設有咖啡機。接待櫃台可應要求提供行李寄存服務。",雙人房、標準雙人房、四人房－附陽台、高級家庭房
628,中間民宿,9.4,好極了,8 則評語,https://cf.bstatic.com/xdata/images/hotel/square600/319173460.jpg?k=8760222e5eb7c2f3c43adad25612f5ba73db97cc71bbce19e200e9083185b3fd,https://www.booking.com/hotel/tw/zhong-jian-min-su.zh-tw.html,花蓮縣花蓮市Hualien City成功街46之8號,"中間民宿位在花蓮縣的花蓮市，靠近松園別館和花蓮城隍廟，提供免費私人停車位。
每個房型都設有私人衛浴和淋浴設施、空調、平面電視以及冰箱。
中間民宿提供露台供住客使用。
這間住宿附近的人氣景點包括花蓮文化創意產業園區、南濱公園（Nanbin Park）和東線鐵道遺址。最近的機場是花蓮機場，距離中間民宿 6 公里。",雙人房、雙人房－附 SPA 浴缸、雙人／雙床房、四人房
629,楓之宿,9.1,好極了,130 則評語,https://cf.bstatic.com/xdata/images/hotel/square600/54618572.jpg?k=9d0f27c70be89924ed8ad32aab7ee6df92a4efae0c51366c962be996b4f54ca3,https://www.booking.com/hotel/tw/fong-su-bnb.zh-tw.html,花蓮縣花蓮市Hualien City國民12街32號,"預訂楓之宿可享 Genius 折扣！只要登入，預訂此住宿即可省一筆。
楓之宿距離花蓮火車站僅 5 分鐘的步行路程，民宿提供現磨咖啡和免費 WiFi。
客房均配有空調。私人衛浴裡配有淋浴、浴缸或淋浴和吹風機。房內另備有床單、風扇和清潔用品。
館內設有共用休息室和行李寄存處。客人可免費停車。",高級雙人房－附淋浴、豪華雙人房－附淋浴、舒適三人房－附淋浴、家庭套房- 帶淋浴
630,花蓮 Cozy Stay 舒適好宅,9.7,傑出,21 則評語,https://cf.bstatic.com/xdata/images/hotel/square600/307946810.jpg?k=cfd0a2deb1ba26b4ff6d4d2b93d030e69366708ff32db51d2df3dbb1602f708d,https://www.booking.com/hotel/tw/hua-lian-shu-shi-wo-min-su.zh-tw.html,花蓮縣花蓮市Hualien City國興三街26,"花蓮 Cozy Stay 舒適好宅位在花蓮市，提供 WiFi（免費）、空調、共用休息室和露台，距離 Beibin Park Beach 2.1 公里，距離松園別館 1.4 公里。
花蓮 Cozy Stay 舒適好宅設有附淋浴設施的私人衛浴，並提供平面電視、拖鞋和吹風機。
這間住宿附近的人氣景點包括花蓮天惠堂、美崙山生態公園和慈濟靜思堂。最近的機場是花蓮機場，距離花蓮 Cozy Stay 舒適好宅 4 公里。",豪華加大雙人床房、豪華四人房、經典四人房、加大雙人床房－附陽台、舒適四人房
631,松園街68號會館,9.6,傑出,13 則評語,https://cf.bstatic.com/xdata/images/hotel/square600/314406736.jpg?k=2f0174aa9c1dbec0c41ca28009888fecd66beb844e365f9cce36355176a085c2,https://www.booking.com/hotel/tw/song-yuan-jie-68hao.zh-tw.html,花蓮縣花蓮市Hualien City松園街68號,"Songyuan 68 Villa 位於花蓮市，靠近 Beibin Park Beach 、松園別館和美崙山生態公園，提供 WiFi（免費）。住客可以使用共用休息室和花園。
Songyuan 68 Villa 有露台。
這間住宿附近的人氣景點包括北濱公園、花蓮鐵道文化園區和東線鐵道遺址。最近的機場是花蓮機場，距離 Songyuan 68 Villa 4 公里。",園景四人房、加大雙人床房、豪華雙人房－附浴缸、小型雙人／雙床房
632,花蓮新館祂你我民宿,,,,https://cf.bstatic.com/xdata/images/hotel/square600/316105318.jpg?k=3264609adb7b3520356508c69b488ca5007806e5fd47a08637517a1a9898f0b5,https://www.booking.com/hotel/tw/hua-lian-xin-guan-ta-ni-wo-min-su.zh-tw.html,花蓮縣吉安南海六街180號,"Gly Gardens 位在吉安，距離 Blue Coastal Beach 2.1 公里，距離知卡宣森林公園不到 1 公里，提供空調，開放花園供住客使用。
Gly Gardens 設有附淋浴設施的私人衛浴，並提供平面電視、吹風機和免費盥洗用品。
這間住宿距離花蓮阿美文化村 1.4 公里，距離花蓮慈惠堂 3.3 公里。最近的機場是花蓮機場，距離 Gly Gardens 9 公里。",經濟雙人／雙床房、經濟雙人房、豪華雙人房－附陽台、經濟四人房、豪華四人房、家庭房
633,星星跳浪民宿,8.5,非常好,66 則評語,https://cf.bstatic.com/xdata/images/hotel/square600/47582138.jpg?k=ee5642aee9e2593af53d1b86ba1efd4c127314ee88560f32181fbfeefaadea40,https://www.booking.com/hotel/tw/xiang-mao-du-jia-min-su.zh-tw.html,"花蓮縣吉安No. 199, Section 2, Zhikaxuan Boulevard","預訂星星跳浪民宿可享 Genius 折扣！只要登入，預訂此住宿即可省一筆。
鄉貌休閒民宿位於花蓮吉安，館內備有自行車供客人免費使用。另外也提供釣魚、騎馬、潛水和划獨木舟等休閒活動。全館提供免費 WiFi 。
民宿距離吉安車站為 9 分鐘的開車車程，距離松園別館為 13 分鐘的開車車程，距離花蓮車站則是 16 分鐘的開車車程，
客房均配有電視、空調和陽台。廚房設備齊全，配有微波爐和冰箱。獨立衛浴內附淋浴設施、吹風機和免費盥洗用品。客房享有山景和花園景觀。
民宿設有花園、烤肉設施和露台。館內亦設有水上運動設施、會議設施和共用休息室。提供免費停車場。",標準雙人房－附陽台、高級雙人房－附陽台、豪華特大雙人床房、花園景豪華特大雙人床房、四人房－附私人衛浴、高級四人間- 帶私人浴室、家庭房－附私人衛浴、三臥室小屋、雙臥室 Villa、標準雙人房、四人房－附私人衛浴
634,天空樹,8.7,很棒,14 則評語,https://cf.bstatic.com/xdata/images/hotel/square600/193453809.jpg?k=86ff9b00ecaf697aa0ca333c53853f6f706a1bf14c508083d6a974abd4076212,https://www.booking.com/hotel/tw/hua-lian-lan-yuan-min-su.zh-tw.html,花蓮縣吉安南海三街200巷6號,"天空樹位於花蓮縣吉安鄉，距離吉安慶修院約 3.5 公里，附設免費私人停車場，且全館提供免費 WiFi。
民宿每間客房均配備空調和平面電視，設有附淋浴設施的私人衛浴。為讓住客有更舒適的住宿體驗，也提供拖鞋、吹風機和免費盥洗用品。
館內設有公共休息區。
民宿距離吉安鄉中心約 1 公里。如有需求，館內可提供租車服務。",雙床房－附露台、四人房－附陽台、豪華 Villa
