id,title,score_badge,score_text,score_subtext,thumbnail,site,full_address,full_description,room
195,向日葵民宿,8.9,很棒,199 則評語,https://cf.bstatic.com/xdata/images/hotel/square600/257722037.jpg?k=6318c1b20f43864661cb1389c4565cd6825476f361f707e8cf53012d6f1dc561,https://www.booking.com/hotel/tw/sunflower-b-n-b.zh-tw.html,花蓮縣花蓮市Hualien City富陽路12號,"預訂向日葵民宿可享 Genius 折扣！只要登入，預訂此住宿即可省一筆。
向日葵民宿位於花蓮。
客房均設有電視、空調。私人衛浴配有淋浴和免費盥洗用品。另外也提供床單。
民宿距離花蓮火車站僅為 5 分鐘的步行路程。",豪華雙人房、奢華四人房
196,六福客棧旅社,7.5,好,160 則評語,https://cf.bstatic.com/xdata/images/hotel/square600/195335150.jpg?k=13263cb46e86ccf8b7a95276eaa7f2f5120fb0f89ef1fbb518f0961ff62ea354,https://www.booking.com/hotel/tw/lienfook.zh-tw.html,花蓮縣花蓮市Hualien City中正路336巷1弄1號,"六福客棧旅社位在花蓮市中正路上，館內客房均裝有空調，房內裝式典雅，並配有私人衛浴及免費 WiFi。館內設有觀光旅遊櫃檯。
飯店距離花蓮火車站或熱鬧的東大門夜市僅 5 分鐘車程，距離花​​蓮機場有 10 分鐘車程。
客房裝飾現代且精美，房內配有平面電視、書桌及迷你吧。為提供便利的住宿體驗，房內亦備有免費盥洗用品。
觀光櫃台可協助安排一日遊行程，接待櫃台可協助存放行李。",標準雙人房、高級雙人房、高級雙床房、家庭房、標準雙人房－1 樓
197,海洋曼波民宿,9,好極了,64 則評語,https://cf.bstatic.com/xdata/images/hotel/square600/131818072.jpg?k=60982004899e4c07d829d013a00318a78990db1541f4002a8ede00d399e2ff79,https://www.booking.com/hotel/tw/hai-yang-man-bo-min-su.zh-tw.html,花蓮縣吉安海濱106之5號,"Ocean Mam Bo Homestay 位於花蓮縣的吉安，距離 Blue Coastal Beach 不到 1.1 公里，提供 WiFi（免費）、兒童遊樂場、共用休息室和免費私人停車位。
所有房型均有座位區、有線頻道平面電視，私人衛浴有沖洗座、淋浴設施和浴缸，且附拖鞋、。住宿提供冰箱和電熱水壺。
Ocean Mam Bo Homestay 有烤肉設備。
如果住客想探索該地區，可以在附近地區健行、騎自行車和釣魚。這間住宿可以安排租車服務。
Ocean Mam Bo Homestay 距離花蓮阿美文化村 2.1 公里，距離知卡宣森林公園 3.7 公里。最近的機場是花蓮機場，距離 Ocean Mam Bo Homestay 9 公里。",雙人房－附陽台、舒適三人房、家庭套房－附陽台、四人房－附陽台
198,呼吸民宿,9.3,好極了,45 則評語,https://cf.bstatic.com/xdata/images/hotel/square600/104591540.jpg?k=3cd305006013c06857dd814f55b6c9ed837d2af1921f2b74a0b7290317172cb6,https://www.booking.com/hotel/tw/hu-xi-min-su.zh-tw.html,花蓮縣吉安吉祥三街22-2號,"預訂呼吸民宿可享 Genius 折扣！只要登入，預訂此住宿即可省一筆。
呼吸民宿從木工、油漆到設計均由業主自行打造。全館提供免費 WiFi。
呼吸民宿距離花蓮火車站步行 10 分鐘，距離吉安客運站步行 3 分鐘，距離山區和大海皆為 3 公里，距離太魯閣國家公園 25 公里。
每間客房均設有空調、平面電視以及附浴缸或淋浴的私人衛浴。為了客人旅途的舒適，也備有拖鞋和免費盥洗用品。
館內設有觀光旅遊櫃檯。民宿備有自行車供客人免費使用，也提供自行車租賃服務。",經濟雙床房、經濟雙人房、雙人房、標準四人房、經濟四人房、家庭房
199,美麗晨曦,9.4,好極了,45 則評語,https://cf.bstatic.com/xdata/images/hotel/square600/269896772.jpg?k=7fa843cb5bdc5a912a1913b207bb2daa846a90a53b952c6fd9b57dd7fa9deee6,https://www.booking.com/hotel/tw/prettysun.zh-tw.html,花蓮縣吉安太昌村明義二街16號,"美麗晨曦位於花蓮吉安鄉，以山脈為背景，可欣賞美麗的日出景觀。鄉村風格的木製傢俱、溫暖的燈光和周圍綠意盎然景觀為客人提供輕鬆氛圍。業主可作為導遊，與客人一同遊覽風景秀麗的花蓮。
客房透過落地窗或玻璃門，享有明亮的自然光線和美景，享有空調。所有客房均舖有拋光木地板，提供免費 WiFi、平面電視、迷你吧和私人衛浴。部分客房設有私人花園，其他客房則設有陽台。
民宿距離花蓮火車站和花蓮機場有 10 分鐘的車程，距離南濱公園和自強夜市均有不到 5 分鐘的車程，距離太魯閣國家公園有 30 分鐘車程。
館內咖啡廳每日供應早餐。另外，民宿距離數家當地的餐廳有不到 5 分鐘的步行路程。",帶花園的雙人間、山景雙人房、高級四人房、家庭房（6 位成人）、頂級四人房
200,撒花庄庭園民宿,8.8,很棒,45 則評語,https://cf.bstatic.com/xdata/images/hotel/square600/257262085.jpg?k=e97e8ec4af352c70432af1802af75abc31d02c7485cb70455313f2561a3e63c7,https://www.booking.com/hotel/tw/flower-villa.zh-tw.html,花蓮縣吉安仁和村南海三街316之1號,"Flowers Bed and Breakfast 位於花蓮縣吉安鄉，提供免費 WiFi 。
民宿距離知卡宣森林公園步行 3 分鐘；距離花蓮遠雄海洋公園 8 分鐘車程；距離市區夜市 6 分鐘車程。
客房均可欣賞花園景緻，設有空調、電視、書桌，提供床單和清潔用品。獨立衛浴內附淋浴設施、吹風機和免費盥洗用品。
民宿設有花園、露台、共用休息室、觀光旅遊櫃檯、免費停車場，亦提供票券服務。",標準雙人房、四人房－附陽台、舒適家庭房
201,塞維爾鄉村旅店,9,好極了,73 則評語,https://cf.bstatic.com/xdata/images/hotel/square600/249905421.jpg?k=4196b4c368eff79cc54d0da30920dc8a2d6189611527822535425d5f9aeebed0,https://www.booking.com/hotel/tw/seville-countryfield-bnb.zh-tw.html,花蓮縣花蓮市Hualien City忠義二街53-5號,"預訂塞維爾鄉村旅店可享 Genius 折扣！只要登入，預訂此住宿即可省一筆。
Seville Countrified B&B 位於花蓮市忠義二街，館內裝潢為鄉村風格，搭配明亮柔和色彩。提供時尚客房、免費 WiFi 、每日早餐和手工甜點。
旅館距離松園別館和南濱夜市均為 10 分鐘車程；距離七星潭海濱公園 15 分鐘車程；距離花蓮車站和花蓮機場則不到 20 分鐘車程。
典雅客房採光充足，房內鋪設木質地板。設有空調、木質家具、舒適休息區、沙發、書桌、平面有線電視、冰箱，提供免費瓶裝水。獨立衛浴內附淋浴設施、室內拖鞋和免費盥洗用品。部分客房則配有陽台。
旅館可提供花蓮及周圍地區的旅遊資訊、收費洗衣服務、機場接駁、自行車租賃服務。附近亦設有便利商店和當地餐廳、飲料店。",標準雙人房、高級雙人房、豪華雙人房、豪華四人房
202,洄瀾樂活 Hui Lan Lohas B&B,8.9,很棒,57 則評語,https://cf.bstatic.com/xdata/images/hotel/square600/249738698.jpg?k=13c19dc45eeb5c14d3d1974d26fc05156da32e5b2ad454c827667be58988ba8a,https://www.booking.com/hotel/tw/hui-lan-le-huo.zh-tw.html,"花蓮縣花蓮市Hualien CityNo. 28, Fuyu 3rd Street","預訂洄瀾樂活 Hui Lan Lohas B&B可享 Genius 折扣！只要登入，預訂此住宿即可省一筆。
洄瀾樂活 Hui Lan Lohas B&B 位於花蓮市，設有共用休息室，靠近慈濟靜思堂、花蓮天惠堂和花蓮縣立體育場。
所有房型都有陽台、空調、平面電視，以及私人衛浴，並提供淋浴設施和拖鞋。為了讓您更加方便，住宿可提供額外收費的毛巾和寢具。
洄瀾樂活 Hui Lan Lohas B&B 每個早上供應單點式早餐。
這間住宿有陽光露台。
洄瀾樂活 Hui Lan Lohas B&B 提供租車服務。
洄瀾樂活 Hui Lan Lohas B&B 距離 Beibin Park Beach 2.8 公里，距離松園別館 3.6 公里。最近的機場是花蓮機場，距離這間住宿 4 公里。住宿提供付費機場接駁服務。",雙人房－附私人衛浴、標準雙人或雙床房－附陽台、四人房－附浴缸、家庭房－附衛浴
203,花蓮山緹歐式景觀別墅 寵物友善,8.2,非常好,20 則評語,https://cf.bstatic.com/xdata/images/hotel/square600/295598962.jpg?k=df57c629595aa8b19705ea3e2c0029d1405d0b13e8720daffe70203bf37e4d79,https://www.booking.com/hotel/tw/shan-ti-ou-shi-min-su.zh-tw.html,"花蓮縣吉安No.12, Lane 801, Section 1, Fuchang Road","預訂花蓮山緹歐式景觀別墅 寵物友善可享 Genius 折扣！只要登入，預訂此住宿即可省一筆。
山緹歐式景觀民宿位於吉安鄉，距離花蓮火車站 20 分鐘車程。坐擁優美山景，提供寬敞花園、公共區域免費 WiFi 和免費停車場。
民宿距離吉安慶修院 7 分鐘車程；距離花蓮文化創意產業園區 17 分鐘車程；距離著名的東大門夜市 20 分鐘車程。
客房均鋪設硬木地板，設有獨立衛浴，內附淋浴設施、免費盥洗用品和吹風機。
為了您的方便，民宿可提供行李寄存處、租車服務和觀光旅遊資訊。",山景四人房、家庭房、山景雙床房、舒適四人房、樓中樓四人房、四人房、山景三人房
204,伍百里驛站,9.3,好極了,59 則評語,https://cf.bstatic.com/xdata/images/hotel/square600/123313716.jpg?k=32fb53e1b91aa6125f712ba94e6f7e40ce9837cac72c0a4986b1d25c8fd04f87,https://www.booking.com/hotel/tw/wu-bai-li-yi-zhan.zh-tw.html,花蓮縣花蓮市Hualien City北濱街106號,"500Km Home 位於花蓮市，距離 Beibin Park Beach 100 公尺，住宿提供 WiFi（免費）和空調。住客可以使用露台。
500Km Home 設有附淋浴設施的私人衛浴，並提供平面電視、拖鞋和吹風機。
經過一天的健行或騎自行車活動之後，住客可以在共用休息室放鬆身心。
這間住宿附近的人氣景點包括松園別館、北濱公園和花蓮鐵道文化園區。最近的機場是花蓮機場，距離 500Km Home 5 公里。",山景雙人／雙床房、標準雙人或雙床房、三人房－附私人衛浴、四人房－附陽台
205,怡然居攝影風格民宿,9.9,傑出,122 則評語,https://cf.bstatic.com/xdata/images/hotel/square600/239951398.jpg?k=ce89622e5eaf321061097b941f904202554fa3c1e7d987113841bc0295da9fb3,https://www.booking.com/hotel/tw/errantry-lodge.zh-tw.html,花蓮縣花蓮市Hualien City建德街50號,"怡然居攝影風格民宿位於花蓮市，距離花蓮火車站 4 公里，全館提供免費 WiFi 和空調客房。
客房均設有平面電視和熱水壺，私人衛浴內附拖鞋、免費盥洗用品和吹風機。
館內提供禮賓服務。
該地區是溯溪、賞鯨和潛水的熱門場所。館方備有自行車供客人免費使用。",豪華雙人房－附浴缸、豪華大床間- 帶淋浴、豪華雙人房－附淋浴、高級雙人房－附浴缸
206,花蓮七星潭海灣民宿,8.9,很棒,254 則評語,https://cf.bstatic.com/xdata/images/hotel/square600/321315779.jpg?k=bf73b974f63d48f880b12ca698bbcf3aa883524c8f51c5083b1b8af2669a0314,https://www.booking.com/hotel/tw/hua-lian-qi-xing-tan-hai-wan-min-su.zh-tw.html,花蓮縣大漢村七星街79巷25號,"預訂花蓮七星潭海灣民宿可享 Genius 折扣！只要登入，預訂此住宿即可省一筆。
七星潭海灣民宿位於花蓮，距離七星潭海灘僅幾步之遙，附設陽光露台，可欣賞山景和海景。民宿提供免費 WiFi 和免費停車場。
七星潭海灣民宿距離花蓮火車站和東大門夜市 15 分鐘車程，距離風景壯闊的太魯閣國家公園僅 25 分鐘車程。
每間客房均配有空調、衣櫃、平面電視和冰箱。私人衛浴內配有浴缸或淋浴設備，並備有免費盥洗用品及吹風機。
此區非常適合騎車觀光，住客可免費向民宿租借自行車。亦備有燒烤設備供客人使用。工作人員可協助行李寄存和提供旅遊資訊。",蜜月間-帶浴缸、標準雙人房、四人房－附私人衛浴、山景家庭房、VIP家庭間
207,晨曦農業休閒民宿,8.1,非常好,62 則評語,https://cf.bstatic.com/xdata/images/hotel/square600/252080669.jpg?k=7f08366833ff454731b2d4faaa6fc9b2bc5de2982496cb8e94ac48252645fd50,https://www.booking.com/hotel/tw/chen-xi-nong-ye-xiu-xian-min-su-hualien-county.zh-tw.html,花蓮縣吉安福興村福興八街325號,"預訂晨曦農業休閒民宿 可享 Genius 折扣！只要登入，預訂此住宿即可省一筆。
Dawn B&B 位在花蓮縣的吉安，距離蓮城蓮花園不到 1.4 公里，提供 WiFi（免費）、烤肉設備、花園和免費私人停車位。
Dawn B&B 提供單點式或全套英式／愛爾蘭式早餐。
這間住宿距離吉安慶修院 2.2 公里，距離花蓮慈惠堂 5 公里。最近的機場是花蓮機場，距離 Dawn B&B 9 公里。",豪華四人房、豪華家庭套房、園景四人房、園景三人房、加大雙人床房－附陽台、加大雙人床房－附 2 張加大雙人床、加大雙人床房－附陽台
208,那山吶海-七星潭電梯民宿,9.4,好極了,283 則評語,https://cf.bstatic.com/xdata/images/hotel/square600/279882155.jpg?k=ef5a125e67bf14cad1610e0b812a0b9af67fdd7aa7d47ff0228665cf4fc8007c,https://www.booking.com/hotel/tw/na-shan-ne-hai-min-su.zh-tw.html,花蓮縣大漢村大漢村七星街91號,"預訂那山吶海-七星潭電梯民宿可享 Genius 折扣！只要登入，預訂此住宿即可省一筆。
Na San Na Hai B&B 設有共用休息室、花園以及附陽台和 WiFi（免費）的住宿，距離 Qixingtan Beach 200 公尺。
所有房型都有戶外休息區、空調、平面電視，以及私人衛浴，並提供沖洗座和拖鞋。住宿提供冰箱和電熱水壺。
Na San Na Hai B&B 的住客可以享用歐陸式早餐。
這間住宿有露台。
Na San Na Hai B&B 提供租車服務。
Na San Na Hai B&B 距離七星潭海濱公園 700 公尺。最近的機場是花蓮機場，距離這間住宿 1 公里。",高級雙人房－附陽台、豪華雙人房－附陽台、四人房－附陽台、側面海景豪華雙人房
209,瑞穗溫泉,7,好,235 則評語,https://cf.bstatic.com/xdata/images/hotel/square600/138396646.jpg?k=2198a9ebc755f46b93d8f94d749ae01a9cbde2170f33a81c575ecca5c2ae3ba6,https://www.booking.com/hotel/tw/rui-sui-wen-quan.zh-tw.html,花蓮縣瑞穗鄉紅葉村23號,"預訂瑞穗溫泉可享 Genius 折扣！只要登入，預訂此住宿即可省一筆。
JS Hotspring 位於瑞穗鄉，距離瑞穗農場不到 7 公里，有觀光旅遊櫃台、全面禁菸客房、共用休息室、全館WiFi（免費）以及花園。這間住宿設有行李寄放服務，也有露台。這間旅館設有溫泉浴池和票券服務。
JS Hotspring 的住客可以享用亞洲風味早餐。
最近的機場是花蓮機場，距離這間住宿 65 公里。",標準雙人房、標準四人房、女性宿舍房的單人床、男性宿舍房的單人床、日式四人房
210,白色宮殿民宿,9.6,傑出,70 則評語,https://cf.bstatic.com/xdata/images/hotel/square600/143487406.jpg?k=52fa09e38dbb2e67faf4bbb364f21e962e2bae484521cb238f8a521386821c5a,https://www.booking.com/hotel/tw/whitepalace-b-and-b.zh-tw.html,花蓮縣吉安北安街31號,"預訂白色宮殿民宿可享 Genius 折扣！只要登入，預訂此住宿即可省一筆。
壯觀的白色宮殿民宿位於吉安鄉，是一棟歐式風格的建築，以現代的白色系為題，提供免費自行車和免費 WiFi。距離熱鬧的東大門夜市約 10 分鐘車程。步行不到 10 分鐘即可抵達著名的 055 海鮮餐廳。
部分客房設有浴缸、休息區和辦公桌。部分客房設有附淋浴設備或浴缸的私人衛浴。
民宿每天早晨供應早餐。附近亦有各種餐廳可供選擇。
工作人員可協助客人安排旅遊活動。也提供機場接駁服務。客人可於民宿周遭從事各種活動，包括打高爾夫球和騎自行車等。室外亦設有美麗的景觀花園和親子餵魚池。
白色宮殿民宿地點便利，位於花蓮市吉安鄉中心，距離市區的購物區 10 分鐘車程，距離太魯閣國家公園 30 分鐘車程。民宿距離花蓮火車站 10 分鐘車程，距離松園別館 13 分鐘車程，距離花蓮遠雄海洋公園 24 分鐘車程，
民宿周圍有許多知名餐廳，工作人員很樂意推薦並提供交通資訊。",市景高級雙人房、山景高級雙人房、山景四人房、四人房－附露台、家庭房－附露台、標準雙人房、三人房－附露台
211,Bellalia 貝拉利亞 花蓮民宿,8.9,很棒,34 則評語,https://cf.bstatic.com/xdata/images/hotel/square600/74688116.jpg?k=675b4314852968bef326540b8dad1faa0a5507c46194954ee3bef4d03ed1a1d5,https://www.booking.com/hotel/tw/bellalia-homestay-hualien.zh-tw.html,"花蓮縣花蓮市Hualien CityNo. 57, Minzu Road","預訂Bellalia 貝拉利亞 花蓮民宿可享 Genius 折扣！只要登入，預訂此住宿即可省一筆。
貝拉利亞飯店四周花園環繞，是座歐洲風格的鄉村別墅。飯店提供寬敞客房、每日早餐和免費 WiFi。距離南濱公園、南濱夜市和松園不到 10 分鐘車程。
客房設有空調、風扇、高級寢具和羽絨床單。亦配有平面有線電視、沏茶／咖啡設施，並提供瓶裝水。私人衛浴附有浴缸和淋浴設施，並備有盥洗用品。
客人可安排前往海洋公園一日遊或從事賞鯨等活動。喜歡於室內活動的客人可於室內或室外休息區享受清新空氣和寧靜的自然美景。
飯店距離花蓮機場有 13 分鐘車程，距離花蓮火車站有 15 分鐘車程。距離七星潭則有 16 分鐘車程。",雙人房、四人房、標準雙人房
212,童心童趣親子民宿,8.9,很棒,67 則評語,https://cf.bstatic.com/xdata/images/hotel/square600/116988043.jpg?k=96b3cb00141d1aa9f2b9418bcc1756f14f0c0df45f5353710db556c033d66036,https://www.booking.com/hotel/tw/tong-xin-tong-qu.zh-tw.html,花蓮縣吉安吉安鄉吉豐路一段16巷1號,"童心童趣親子民宿位於花蓮吉安，房內提供溜滑梯。
每間客房均配有平面電視，客人可於露台或陽台上享用茶飲。所有房型均附私人衛浴。另亦備有拖鞋和免費盥洗用品。
東大門夜市距離童心童趣親子民宿僅 8 分鐘車程，距離遠雄海洋公園 10 分鐘車程。",豪華家庭套房、家庭套房－附陽台、四人房－附陽台、日式四人房
213,花漾村聲民宿,9.2,好極了,53 則評語,https://cf.bstatic.com/xdata/images/hotel/square600/277117263.jpg?k=a0d654c8ebb9c7608c29c7ef851c90c536f6e90f1e591b616de98ba35feaba70,https://www.booking.com/hotel/tw/hua-yang-cun-sheng-min-su.zh-tw.html,花蓮縣花蓮市Hualien City林政街53號,"預訂花漾村聲民宿可享 Genius 折扣！只要登入，預訂此住宿即可省一筆。
花漾村聲民宿位於花蓮市，距離松園別館 1.9 公里。
房內均配有電視、藍光播放機和熱水壺。每間客房均配有私人衛浴。為提供舒適的住宿體驗，房內備有免費盥洗用品及吹風機。館內設有免費 WiFi 及免費私人停車場。
民宿提供免費接駁服務，須提前 3 天預訂。
民宿內備有自行車供客人免費使用，也提供租車服務。民宿距離花蓮文化創意產業園 900 公尺，距離慈濟文化園區 1.8 公里。",豪華雙床房、標準四人房、家庭房－附浴缸、樓中樓套房、豪華雙人房－附浴缸
214,瑞穗山下的厝溫泉民宿,9.3,好極了,145 則評語,https://cf.bstatic.com/xdata/images/hotel/square600/67081685.jpg?k=a68c5e591fa9f542ba0d0fd0b1e68f85dac35587c398cd1528cd158e5ddb2e8d,https://www.booking.com/hotel/tw/rui-sui-shan-xia-de-cuo-wen-quan-min-su.zh-tw.html,花蓮縣瑞穗鄉瑞祥村溫泉路3段137號,"Ruisui Sunshine Hot Spring B&B 位於花蓮縣的瑞穗鄉，提供 WiFi（免費）和免費私人停車位。住客可以使用溫泉浴池。
所有房型都有戶外休息區、空調、平面電視，以及私人衛浴，並提供熱水按摩池和拖鞋。住宿也提供冰箱、迷你吧和電熱水壺。
Ruisui Sunshine Hot Spring B&B 每個早上供應歐陸式早餐。
這間住宿的住客可以使用熱水按摩池。
Ruisui Sunshine Hot Spring B&B 的住客可在附近騎自行車，或使用花園。
Ruisui Sunshine Hot Spring B&B 距離瑞穗農場 6 公里。最近的機場是花蓮機場，距離這間住宿 65 公里。",豪華雙人房－附陽台、豪華四人房
215,雲享渡假莊園,8.9,很棒,165 則評語,https://cf.bstatic.com/xdata/images/hotel/square600/85230833.jpg?k=b26a610c2b5006bc1c2b9522bd07ea628eb6ae151106356993d7c770c96967ee,https://www.booking.com/hotel/tw/cloudenjoy.zh-tw.html,花蓮縣花蓮市Hualien City豐村路19-9號,"雲享渡假莊園位於花蓮，提供免費自行車和免費 WiFi。
每間客房都提供空調、陽台和露台。用餐區配有冰箱和餐桌。私人衛浴設有浴缸和淋浴設施。客房享有山景和花園景觀。額外提供熱水浴缸和休息區。
民宿設有花園、燒烤設施和露台。其他設施包括共用休息室、行李寄存處和兒童遊樂場。客人可於館內或周邊地區騎乘自行車或進行其他活動。民宿提供免費停車場。",山景家庭房、豪華雙人房－附陽台
216,花蓮巴黎寓所民宿,8.8,很棒,40 則評語,https://cf.bstatic.com/xdata/images/hotel/square600/92816220.jpg?k=1e9925aa4eee0f1df44e1e5b736b4369069cf40b7af7d59af631d6222fea3d9d,https://www.booking.com/hotel/tw/hualien-paris-homestay.zh-tw.html,花蓮縣花蓮市Hualien City國民六街56號,"預訂花蓮巴黎寓所民宿可享 Genius 折扣！只要登入，預訂此住宿即可省一筆。
花蓮巴黎寓所民宿距離花蓮機場僅 15 分鐘車程，館內擁有法國鄉村風格的內飾。民宿提供免費自行車租賃服務、免費 WiFi 及花蓮車站的免費接站服務。
客房均擁有時尚新穎的配置，並附有陽台、休息區、平面電視、冰箱、沏茶／咖啡設施及泡麵。附設的私人衛浴內配有淋浴設備，並備有盥洗用品。
民宿距離七星潭有 20 分鐘車程，距離太魯閣國家公園有 40 分鐘車程。
觀光旅遊櫃檯可協助安排旅遊行程。櫃台工作人員可提供票券、租車及行李寄存服務。",雙人房、豪華雙人／雙床房－附陽台、標準雙人或雙床房、標準雙人房、高級雙人或雙床房、豪華雙人／雙床房－附陽台
217,11 號咖啡民宿,9.1,好極了,177 則評語,https://cf.bstatic.com/xdata/images/hotel/square600/225674679.jpg?k=6cb12849b086036c65713d4eb008b15199dcbcab4d95ac23cd94df5976c5ff73,https://www.booking.com/hotel/tw/wei.zh-tw.html,花蓮縣花蓮市Hualien City尚志路35之13號,"預訂11 號咖啡民宿可享 Genius 折扣！只要登入，預訂此住宿即可省一筆。
No. 11 Cafe 位於花蓮市，提供 WiFi（免費）、空調、共用休息室和花園，距離 Beibin Park Beach 2.7 公里，距離松園別館 4.3 公里。館內提供私人停車位。
為了讓您更加方便，住宿可提供額外收費的毛巾和寢具。
No. 11 Cafe 有露台。
這間住宿提供租車服務。
No. 11 Cafe 距離花蓮天惠堂 1.7 公里，距離美崙山生態公園 2.3 公里。最近的機場是花蓮機場，距離 No. 11 Cafe 2 公里。",高級加大雙人床房－附 2 張加大雙人床、雙人房－附私人衛浴、雙人房－附共用衛浴、經典四人房
218,七星潭七星天使民宿,9.4,好極了,141 則評語,https://cf.bstatic.com/xdata/images/hotel/square600/74381219.jpg?k=530150f55faff42cad9263f6004ac8f155ed4a57bef793192824462298442901,https://www.booking.com/hotel/tw/a-fae-ya-c-a1-2-aedeg-a-r.zh-tw.html,花蓮縣大漢村七星街79巷2號,"預訂七星潭七星天使民宿可享 Genius 折扣！只要登入，預訂此住宿即可省一筆。
Angel B&B 位在大漢村，享有海景，提供餐廳、共用廚房、酒吧、花園和露台。住宿全館提供 WiFi（免費），館內提供私人停車位。
所有房型均有座位區、衛星頻道平面電視，私人衛浴有淋浴設施，且附拖鞋。住宿也提供冰箱和電熱水壺。
經過一天的健行、騎自行車或釣魚活動之後，住客可以在共用休息室放鬆身心。
Angel B&B 距離 Qixingtan Beach 200 公尺，距離七星潭海濱公園 800 公尺。最近的機場是花蓮機場，距離這間住宿 1 公里。",四人房－附浴缸、四人房－附陽台、三人房－附浴缸、豪華雙人房－附陽台、四人房－附浴缸、雙人房－附陽台
219,喜歡農莊,9.2,好極了,45 則評語,https://cf.bstatic.com/xdata/images/hotel/square600/61336865.jpg?k=947146898ebf45a60df5b3a3272ba09dd2dc54d7a993a8aa0ff16eb330deadb7,https://www.booking.com/hotel/tw/xi-huan-nong-zhuang.zh-tw.html,花蓮縣吉安稻香村廣賢路一段219號,"喜歡農莊位於花蓮縣的吉安鄉，距離花蓮市 3.7 公里，設有露台，可享有山景。
每間客房均裝有空調，並配有平面電視。房內附設私人衛浴。為提供舒適的住宿體驗，房內亦備有拖鞋及吹風機。民宿提供免費 WiFi 並設有免費私人停車場。
民宿提供免費接駁服務。
民宿備有自行車供房客免費使用。
距離花​​蓮火車站和花蓮遠雄海洋公園有 17 分鐘車程，距離松園 18 分鐘的車程。",標準雙人房、高級雙人房、豪華雙人房、標準四人房
